Authors,Title,Year,Source title,Volume,Issue,Art. No.,Page start,Page end,Page count,Cited by,Link,Abstract,Author Keywords,Index Keywords,References,Document Type,Source
"Xie H.","Help features in digital libraries: Types, formats, presentation styles, and problems",2007,"Online Information Review",31,6,,861,880,,4,"http://www.scopus.com/inward/record.url?eid=2-s2.0-36448965990&partnerID=40&md5=39dbf4b27f945593d4db9175e3b04754","Purpose - The purpose of this paper is to evaluate Help features in digital libraries and identify problems related to their design. Design/methodology/ approach - This study selects six digital libraries to represent a variety of digital libraries developed or sponsored by different types of organisations. The Help features of these selected digital libraries are examined by their types (explicit versus implicit), formats (texts, images, screenshots, multimedia materials, and interactive formats), and presentation styles (descriptive, guided, procedural, and exemplary). Findings - This study presents the types of Help features available in the selected digital libraries, and further characterises the formats and presentation styles of these Help features. In the process of analysis, the author also identifies six types of problems: lack of standards; tradeoff between using explicit Help and implicit help; tradeoff between using general Help versus specific Help; lack of interactive Help features; lack of dynamic presentation styles; and lack of Help features for advanced users and users who do not understand English. Research limitations/implications - In order to design Help features that facilitate users to effectively use digital libraries, further research needs to extend studies to what types of help-seeking situations users generally encounter and the corresponding support they need. Originality/value - This study provides insightful information regarding the current status and problems of the Help features in existing digital libraries. © Emerald Group Publishing Limited.","Digital libraries; Information retrieval; Problem solving","Data reduction; Information retrieval; Problem solving; Societies and institutions; Standards; User interfaces; Dynamic presentation; Formats; Presentation styles; Digital libraries","Connell, T.H., Subject searching in online catalogs: Metaknowledge used by experienced searchers (1995) Journal of the American Society for Information Science, 46 (7), pp. 506-18; Cool, C., Xie, H., How can IR help mechanism be more helpful to users? (2004) Proceedings of the 67th ASIST Annual Meeting, pp. 249-55. , Schamber, L. Barry, C.L. Information Today Medford, NJ; Dworman, G., Rosenbaum, S., Helping users to use help: Improving interaction with help systems (2004) CHI '04 Extended Abstracts on Human Factors in Computing Systems, pp. 1717-8. , ACM Press New York, NY; Efthimiadis, E., Online searching aids: A review of front ends, gateways and other interfaces (1990) Journal of Documentation, 46 (3), pp. 218-62; Faiks, A., Hyland, N., Gaining user insight: A case study illustrating the card sort technique (2000) College & Research Libraries, 61 (4), pp. 349-57; Haas, W.S., Brown, L., Denn, S., Locke, D., Shneiderman, B., Toward an enriched (and revitalized) sense of help: Summary of an ASIS&T 2005 Panel Session (2006) Bulletin of the American Society for Information Science & Technology, 32 (5), pp. 23-527; Hill, L.L., Carver, L., Larsgaard, M., Dolin, R., Smith, T.R., Frew, J., Rae, M.A., Alexandria Digital Library: User evaluation studies and system design (2000) Journal of the American Society for Information Science, 51 (3), pp. 246-59; Jansen, B.J., Seeking and implementing automated assistance during the search process (2005) Information Processing and Management, 41 (4), pp. 909-28; Monopoli, M., Nicholas, D., Georgiou, P., Korfiati, M., A user-oriented evaluation of digital libraries: Case study, the 'electronic journals' service of the library and information service of the University of Patras, Greece (2002) Aslib Proceedings, 54 (2), pp. 103-17; Slack, F.E., (1991), ""OPACs: using enhanced transaction logs to achieve more effective online help for subject searching"", unpublished doctoral dissertation, Manchester Polytechnic, ManchesterTrenner, L., A comparative survey of the friendliness of online help in interactive information retrieval systems (1989) Information Processing & Management, 25 (2), pp. 119-36; Wan, G., Visualizations for digital libraries (2006) Information Technology and Libraries, 25 (2), pp. 88-94; Xie, H., Cool, C., Toward a better understanding of help seeking behavior: An evaluation of help mechanisms in two IR systems (2006) Proceedings of the 69th ASIST Annual Meeting, , Dillon, A. Grove, A. available at: http://eprints.rclis.org/archive/ 00008279/01/XieToward.pdf (accessed 2 February 2007); Xie, H., Cool, C., Types of help-seeking situations for novice users of digital libraries: A preliminary study (2007) Proceedings of the 70th American Society of Information Science and Technology, , Learned Information Medford, NJ; Nicholas, D., Huntington, P., Monopoli, M., Watkinson, A., Engaging with scholarly digital libraries (publisher platforms): The extent to which 'added-value' functions are used (2006) Information Processing & Management, 42 (3), pp. 826-42",Article,Scopus
"Buehler M.A., Trauernicht M.S.","From digital library to institutional repository: A brief look at one library's path",2007,"OCLC Systems and Services",23,4,,382,394,,2,"http://www.scopus.com/inward/record.url?eid=2-s2.0-35548976634&partnerID=40&md5=75ddd3bc338626e84c3a5b870afac3d7","Purpose - The purpose of this paper is to give an overview of the initial transformation of one academic library's digital media library into the institutional repository (IR) of its entire academic organization. Design/methodology/approach - Provides a description of an academic digital library's evolution into an institutional repository, accompanied by both practical and philosophical analyses. Findings - Materials supporting an academic institution's scholarship (from colleges and from supporting organizations on campus) can play an important part in the success of an institutional repository. Standards for metadata content, data structures and hierarchies of collections must be followed consistently, and adequate storage for digital media within an institutional repository is necessary to have in advance of anticipated demand for the smooth operation of the IR and continued access to materials. Gray areas between the role of an institutional repository and the role of that organization's archives need to be addressed in the future. Practical implications - Academic libraries can be highly successful in producing an institute repository by developing relationships with various organizations on campus in addition to the academic programs. Maintaining standards throughout the IR is crucial to future growth in an organized and consistent manner. Philosophical considerations of the role of the IR should be addressed in the beginning stages of the development of the IR for eliminating confusion and duplication of its contents with other campus organizations. Originality/value - This paper describes the development of a digital library, created and maintained by an academic library, and its gradual change into a de facto institutional repository. Other libraries in the planning stages or initial steps of creating a campus-wide digital library or an institutional repository can benefit from the description of possible successes and problems that they could encounter during implementation.","Archives management; Digital libraries",,"Buehler, M.A., Boateng, A., ""The evolving impact of institutional repositories on reference librarians"" (2005) Reference Services Review, 33 (3), p. 291; Cervone, H.F., ""The repository adventure"" (2004) Library Journal, 129 (10), pp. 44-46; Hayes, H., (2005) ""Digital Repositories, Helping Universities and Colleges"", , JISC briefing paper, August, Scotland; Pearce-Moses, R., (2005) A Glossary of Archival and Records Terminology, , The Society of American Archivists Chicago, IL",Review,Scopus
"Altenhoner R.","Data for the future The German project ""Co-operative development of a long-term digital information archive"" (kopal)",2006,"Library Hi Tech",24,4,,574,582,,1,"http://www.scopus.com/inward/record.url?eid=2-s2.0-33751414796&partnerID=40&md5=bd71b2466ed6f2c4a795f31b237d722f","Purpose - One of the unresolved problems of the global information society is ensuring the long-term accessibility of digital documents. The project kopal tackles this problem head-on: in a three-year project kopal's objective is the practical testing and implementation of a cooperatively created and operated long-term archival system for digital resources. Design/methodology/approach - The system will be implementedin accordance with international standards for long-term archiving and metadata within the Open Archival Information System (OAIS) framework. The project partners, Die Deutsche Bibliothek (DDB), Göttingen State and University Library (SUB Göttingen), IBM Deutschland GmbH and the Gesellschaft für wissenschaftliche Datenverarbeitung mbH Göttingen (GWDG), will establish a cooperatively transferable solution for cultural heritage institutions, as well as for business and industry. Findings - Within the project, the project partners DDB and SUB Göttingen are developing software for the input and access of data, which will be released under an open-source license. Research limitations/implications - Long-term preservation methods and strategies will be discussed in general in the paper. Practical implications - The project will present a stable and reusable platform for additional partners and users, especially for cultural heritage organisations. Originality/value - The solution is based on Digital Information and Archiving System (DIAS), jointly devised by IBM and the National Library of The Netherlands in The Hague, and it will be adapted to the needs of the project with several extensions. Establishing a collaborative solution for long-term preservation is a milestone in the development of systems for the long-term availability of digital objects.","Archives management; Digital libraries; Digital storage; Germany",,"Neubauer, M., Wollschläger, T., ""Maschinelle Gewinnung technischer Metadaten für die Langzeitarchivierung elektronischer Publikationen"" (2006) B.I.T. Online, 1, pp. 37-40",Article,Scopus
"Zheng S.","Virtual reference services in China: Helping the information-poor",2006,"Electronic Library",24,6,,763,773,,2,"http://www.scopus.com/inward/record.url?eid=2-s2.0-33751160174&partnerID=40&md5=95f6a88132cb7a2e74f472ac7f9fe291","Purpose - The purpose of this study is to explore the construction pattern and the difficulties for China to develop virtual reference services (VRS). Design/methodology/approach - The paper first analyzes the definition and features of the digital library, and is followed by an introduction to the development of VRS in China. Through literature search and checking web sites, some 400 documents in CNKI have been analysed on VRS from the period of January, 1990 to June, 2005, and the situation in developing VRS and problems existing in the course of doing it in China have been summarized. On the basis of connecting theory and practice on VRS, the paper provides general tactics on how to develop VRS for libraries in China. Findings - There are some problems existing for China to develop VRS, namely shortage of funds, the information poor, the digital divide, restrictions of information infrastructure, library management, shortage of technical knowledge and user training. The paper projects what may be needed for China to continue its development of VRS in the future. There is a need for appropriate infrastructures, strategies and mechanisms to be established in order to support the diffusion of VRS principles throughout China. Originality/value - This paper provides some observations and insights on the design and development of VRS in China. It suggests that decision makers in government agencies need to understand the existing gaps in VRS in China. Constructive suggestions are made for China to construct VRS and improve the service level.","China; Information services","Digital libraries; Information retrieval; Information technology; Societies and institutions; World Wide Web; Information infrastructure; Information poor; Library management; Virtual reference services; Information services","Courtright, C., ""Health information-seeking among Latino newcomers: An exploratory study"" (2005) Information Research, 10 (2). , http://informationr.net/ir/10-2/paper224.html, available at:; Ge, S., ""Information and communication technologies for development"" (2003) 58th Session of the General Assembly of the United Nations, , www.cistc.gov.cn/embassymember/browse.asp?id=56016&site= 5461&column=5472, presented at the December 3, 2003. available at:; Jin, Y., Huang, M., Lin, H., Guo, J., ""Towards collaboration: The development of collaborative virtual reference service in China"" (2005) The Journal of Academic Librarianship, 31 (3), pp. 287-291; Li, J., ""Public library shows great concern for information access by the disadvantaged population"" (2005) Journal of Library and Information Sciences in Agriculture, (9), pp. 42-44; Lin, X., Zhang, Y., ""A comparative study of traditional reference services and network reference services"" (2003) Journal of Library Science in China, (6), pp. 44-47; Liu, Z., Li, W., On development of the spirit of public libraries in the digital age (2004) Library Issue, 4, pp. 2-5; Su, H.C., ""Collaboration is the social system of digital reference services"" (2003), http://210.34.4.20/society/jqli/society/paper/2003meeting/shchz.htm, available at:Wang, Z., Xiao, X., ""Library system innovation for knowledge aids to vulnerable groups"" (2005) Knowledge of Library and Information Science, (1), pp. 6-12; Xu, G., ""The construction of library core competence: Integration based on management science"" (2005) Journal of Library Science in China, (1), pp. 26-29; Yan, K., The study of the construction of digital expert reference of Northeast Normal University Library (2005)Yang, G., The development of the China digital library (2002) Electronic Journal of Academic and Special Librarianship, , http://epe.lac-bac.gc.ca/100/201/300/ejasl/2002/v03n03/content/v03n03/ Yang_g01.htm; Yuan, L., Xu, J., On the characteristics and trends of real-time query-answering services (2004) Journal of Library Science in China, 4, pp. 42-44; Zang, G., A theoretical thinking of real-time virtual reference service (2005) Journal of Library Science in China, (3), pp. 24-29; Zhai, J., Problems of virtual reference service in Chinese public libraries and their countermeasures in the New Century (2005) Library Issue, 3, pp. 25-28",Article,Scopus
"Weng C., Mi J.","Towards accessibility to digital cultural materials: An FRBRized approach",2006,"OCLC Systems and Services",22,3,,217,232,,2,"http://www.scopus.com/inward/record.url?eid=2-s2.0-33748165679&partnerID=40&md5=ae95edc8d2b595ec11e0aa5c40242fed","Purpose - The purpose of this paper is to address the key components of building good digital collections. Design/methodology/approach - Different categories of digital collections based on guidelines defined by the authors are presented. Issues related to public access are illustrated. A model using the FRBR entities relationships is proposed to improve the accessibility of digital cultural materials so that scholarly research can be enhanced. The number of digital collections has been increased significantly since the late 1990s, but few studies investigated how these collections were organized and managed. To attain an understanding of the current status of institutional digital collections, various collection sites were examined and analyzed. The study focused on the existence and level of richness of bibliographic descriptions provided for each image; whether a search engine was available or not; how easily the search could be performed; and how search results were organized. The presentation of search results is problematic. Applying the IFLA FRBR model to digital materials can bring a solution. Findings - The IFLA FRBR model presents the search results hierarchically so that related materials can be easily collocated. This feature meets the end-users needs. The attributes of work and expression entities presented in the IFLA FRBR model should be applied differently for event-based digital cultural materials. Defining work- or expression-level entities under the event or theme will be more logical than under author and/or title for cultural materials. Doing expression-level cataloging might also work for this type of materials. Originality/value - Before building a digital collection, institutions should have a well-thought-out and well-planned collection management mechanism. Metadata scheme, content standards and content management system are important fundamentals. Much can be done to improve the accessibility of digital collections. The proposed FRBRized approach will make the retrieval of digital cultural objects easier.","Cataloguing; Content management; Digital libraries; Search engines",,"Besser, H., ""Image databases: The first decade, the present, and the future"" (1997) Digital Image Access and Retrieval, pp. 11-28. , Graduate School of Library and Information Science, University of Illinois at Urbana-Champaign Heidorn, P.B. Urbana-Champaign, IL; Bowen, J., ""FRBR, coming soon to your library?"" (2005) Library Resources and Technical Services, 49 (3), pp. 175-188; Dalbello, M., ""Institutional shaping of cultural memory: Digital library as environment for textual transmission"" (2004) Library Quarterly, 74 (3), pp. 265-298; (2005) Public Access Collections, , www.diglib.org/dlfhomepage.htm, Digital Library Federation (accessed September 27, 2005); (1997) Search the Project Web Site, , http://clio.fivecolleges.edu/search/, Five College Archives Digital Access Projects (accessed September 3, 2005); (1998) Functional Requirements for Bibliographic Record: Final Report, , www.ifla.org/VII/s13/frbr/frbr.pdf, IFLA The Hague, available at: (accessed July 5, 2005); (2004) FRBR Bibliography, , www.ifla.org/VII/s13/wgfrbr/FRBR_bibliography.pdf, IFLA vailable at: (accessed August 17, 2005); (1961) Paris Principles, , www.ddb.de/standardisierung/pdf/paris_principles_1961.pdf, International Conference on Cataloguing Principles available at: (accessed February 9, 2005); Jones, B.M., (2003) Hidden Collections, Scholarly Barriers: Creating Access to Unprocessed Special Collections Materials North America's Research Libraries, , www.arl.org/collect/spcoll/ehc/HiddenCollsWhitePaperJun6.pdf, white paper for the Association of Research Libraries Task Force on Special Collections, available at: (accessed July 5, 2005); (2005) American Memory, , http://memory.loc.gov/ammem/index.html, (The) Library of Congress available at: (accessed August 17, 2005); (2005) American Memory, , http://memory.loc.gov/ammem/about/about.html, (The) Library of Congress About page, available at: (accessed September 3, 2005); Lundy, M.W., Hollis, D.R., ""Creating access to invisible special collections: Using participatory management to reduce a backlog"" (2004) Journal of Academic Librarianship, 30 (6), pp. 466-475; (2003) Search Our Collection, , www.njdigitalhighway.org/search/search.php, New Jersey Digital Highway (NJDH) available at: (accessed August 17, 2005); (2004) A Framework of Guidance for Building Good Digital Collections, , http://diamond.temple.edu:81/search/, NISO Framework Advisory Group 2nd ed., NISO Press, Bethesda, MD, available at: (accessed July-September 2005); O'Connor, D., Chen, L., Callahan, D., ""Evaluating the use of the NYPL Mid-Mahattan Library's digital picture collection"" (2005) Public Libraries, 44 (5), pp. 292-296; (1999) Postcard, 1900-1995 Collection, , http://clio.fivecolleges.edu/smith/postcards/, Smith College Collections Online available at: (accessed 15 August 2005); (2003) Street and Smith Publishers' Archive and Dime Novel Cover Collection, , http://libwww.syr.edu/digital/index.html, Syracuse University Digital Projects available at: (accessed August 15, 2005); Tillett, B.B., ""The FRBR model (functional requirements for bibliographic records)"" (2003) 2003 ALCTS Institute on Metadata and AACR2, , www.loc.gov/catdir/cpso/frbreng.pdf, paper presented at the April 4-5, San Jose, CA., available at: (accessed August 17, 2005); (2005) Cataloging Cultural Objects: A Guide to Describing Cultural Objects and Their Images, , www.vraweb.org/ccoweb/, Visual Resources Association draft, available at: (accessed October 1, 2005); (2004) Beinecke Rare Book and Manuscript Library Digital Image Online, , http://beinecke.library.yale.edu/dl_crosscollex/, Yale University Library available at: (accessed 12 October 2005); (2004) Beinecke Rare Book and Manuscript Library Finding Books, Manuscripts and Images, , http://beinecke.library.yale.edu/dl_crosscollex/, Yale University Library available at: (accessed October 12, 2005); (2003) Historical New Haven Digital Collection, , www.library.yale.edu/newhavenhistory/, Yale University Library available at: (accessed August 18, 2005); (2003) Historical New Haven Digital Collection, , www.library.yale.edu/newhavenhistory/aboutsite.html, Yale University Library About page, available at: (accessed August 18, 2005); (2005) Lewis Walpole Library Digital Collection, , http://lwlimages.library.yale.edu/walpoleweb/, Yale University Lewis Walpole Library Quick Search page, available at: (accessed August 22, 2005); (2005) Lewis Walpole Library, , www.library.yale.edu/walpole/html/research/digital_collection.html, Yale University Lewis Walpole Library Digital Collection page, available at: (accessed August 22, 2005); Yee, M.M., ""FRBRization: A method for turning online public finding lists into online public catalogs"" (2005) Information Technology and Libraries, 24 (3), pp. 77-95",Article,Scopus
