Authors,Title,Year,Source title,Volume,Issue,Art. No.,Page start,Page end,Page count,Cited by,Link,Abstract,Author Keywords,Index Keywords,References,Document Type,Source
"Saiso E.P.","Finding support for disruption: Developing a digital humanities project in Mexico",2012,"Aslib Proceedings: New Information Perspectives",64,1,,97,103,,,"http://www.scopus.com/inward/record.url?eid=2-s2.0-84855774471&partnerID=40&md5=886813dac0e64b81c3615aaecb428cda","Purpose: This paper seeks to provide a description and reflection on some of the structural problems and challenges faced when developing a digital humanities (DH) project in a Mexican public university. Design/methodology/approach: As DH is a relatively new field and practice in Mexican academia, this article is based on a case study of developing the Biblioteca Digital de Pensamiento Novohispano (Digital Library of New Hispanic Thought). This is one of the few DH at the Universidad Nacional Autónoma de México (UNAM), the largest public university in the country. Findings: It was found that there were three central problems for developing a DH project in a Mexican public university: existing technical knowledge and abilities at the UNAM will be challenged by DH projects; projects are the place to train human resources in DH methodology; and researchers need to consider different long-term infrastructure and hosting solutions, with or without using institutional infrastructure, at the same time researches need to work within the institution to establish a specific policy for research projects. Practical implications: The paper concludes that the structure, goals and products of DH projects need to be modified and expanded in order to also consider alternative goals and products such as: proposals of institutional policy, creation of infrastructure and academic and student training. DH projects must be regarded as disruptive, that is that the project needs to assume rupture as a part of the project itself. Originality/value: The experience of innovation and disruption is not necessarily the same in all fields and all institutions. This article documents for the first time the particular experiences of a public university in a developing country with DH projects. It has been found that the delay in using computers in the humanities in Mexico has led to the development of a specific paradox: a gap between institutional interest and disposition in the use of computers in humanities, and the lack of DH culture in those who have to develop the project. © Emerald Group Publishing Limited.","Digital humanities; Digital libraries; Institutional support; Library projects; Mexico; Public university; Scholarly editing","Digital humanities; Institutional support; Me-xico; Public universities; Scholarly editing; Developing countries; Research; Societies and institutions; Digital libraries","Gayosso, B., Cómo se conectó México a Internet (2003) Revista Digital Universitaria, 5 (5). , 1 October; Hockey, S., The history of humanities computing (2004) A Companion to Digital Humanities, , www.digitalhumanities.org/companion/, available at (accessed 2 April 2010), Schreibman, S., Siemens, R., Unsworth, J. (Eds.), Blackwell, Oxford; Micheli, J., (2009) Educación Virtual Y Aprendizaje Instititucional, , Universidad Autónoma Metropolitana, Mexico City; Price, K.M., Electronic Scholarly Editions (2008) A Companion to Digital Literary Studies, , www.digitalhumanities.org/companionDLS/, available at (accessed 10 January 2011), Schreibman, S., Siemens, R., Unsworth, J. (Eds.), Blackwell, Oxford; Revista Digital Universitaria (2004) RDU, 5 (6). , www.revista.unam.mx/indexjul04.html, RDU, July 10, available at, (accessed 2 April 2010); Revista Digital Universitaria (2004) RDU, 5 (10). , www.revista.unam.mx/indexnov04.html, RDU, November 10, available at, (accessed 2 April 2010); Revista Digital Universitaria (2011) RDU, 12 (7). , www.revista.unam.mx/index_jul11.htm, RDU, November 10, available at, (accessed 27 July 2011); Warwick, C., Terraas, M., Hintington, P., Pappa, N., The master builders: LAIRAH research on good practice in the construction of digital humanities projects (2007) Literary and Linguistic Computing, 23 (3), pp. 383-396",Article,Scopus
"Miller L., Blake M., Sorsby M.","Evaluation of the Assessing Institutional Digital Assets (AIDA) toolkit",2012,"Science and Technology Libraries",31,1,,92,99,,,"http://www.scopus.com/inward/record.url?eid=2-s2.0-84859175552&partnerID=40&md5=526d3af2d9f7a02bb07362d632819784","Libraries are becoming more involved in the complex task of managing the digital assets created by members of their institutions. Many tools have been created to help librarians understand and solve the problems associated with this task. One of these tools is the Joint Information Systems Committee's Assessing Institutional Digital Assets (AIDA) toolkit, which is designed to help institutions assess their current readiness and ability to manage digital assets. This article provides a review and evaluation of the AIDA toolkit as used by Los Alamos National Laboratory Research Library. © 2012 Copyright Taylor and Francis Group, LLC.","AIDA toolkit; data management planning; digital asset management tools; digital curation; Joint Information Systems Committee","AIDA toolkit; data management planning; Digital asset management; digital curation; Joint Information Systems Committee; Information management; Information systems; Libraries; Societies and institutions; Digital libraries","(2011) General Information for Authors, , http://www.sciencemag.org/site/feature/contribinfo/prep/gen_info. xhtml#dataavail, American Association for the Advancement of Science Accessed: 24 August 2011; (2011) Policy on Referencing Data in and Archiving Data for AGU Publications, , http://www.agu.org/pubs/authors/policies/data_policy.shtml, American Geophysical Union Accessed: 24 August 2011; Angevaare, I., Taking care of digital collections and data: Curation and organizational choices for research libraries (2009) LIBER Quarterly, 19 (1), pp. 1-12; (2007) Trustworthy Repositories Audit and Certification: Criteria and Checklist, , Chicago, IL: CRL and OCLC. Center for Research Libraries (CRL) and Online Computer Library Center (OCLC); (2009) Digital Curation Centre, , http://www.data-audit.eu/, Data Asset Framework: Implementation Guide; Del Pozo, N., Long, A.S., Pearson, D., Land of the lost: A discussion of what can be preserved through digital preservation (2010) Library Hi Tech, 28 (2), pp. 290-300; (2007) DCC and DPE Digital Repository Audit Method Based on Risk Assessment, b.1.0, , http://www.repositoryaudit.eu/download, Digital Curation Centre and DigitalPreservationEurope Accessed: 15 December 2010; Gold, A., Cyberinfrastructure, data, and libraries, part 1: A cyberinfrastructure primer for librarians (2007) D-Lib Magazine, 13 (9-10). , http://www.dlib.org/dlib/september07/gold/09gold-pt1.html, doi: 10.1045/september20september-gold-pt1; Gray, N., Woan, G., Digital preservation and astronomy: Lessons for funders and the funded (2011) Proceedings of Astronomical Data Analysis Software and Systems XX, 442, pp. 13-16. , http://arXiv.org/abs/1003.2318v1, accessed August 25, 2011; Kenney, A.R., McGovern, N.Y., (2003) The Five Organizational Stages of Digital Preservation. Digital Libraries: A Vision for the 21st Century: A Festchrift in Honor of Wendy Lougee on the Occasion of Her Departure from the University of Michigan, , http://hdl.handle.net/2027/spo.bbv9812.0001.001, Ann Arbor, MI: MPublishing, 2003 Accessed: 19 July 2011; Kenney, A.R., McGovern, N.Y., (2005) The Three-legged Stool: Institutional Response to Digital Preservation (.Ppt). II Convocatoria Del Coloquio de Marzo, Cuba; MacDonald, S., Uribe, L.M., Libraries in the converging worlds of open data, e-research, and web 2.0 (2008) Online, 32 (2), pp. 36-40; (2003) Final NIH Statement on Sharing Research Data. NOT-OD-03-032, , http://grants.nih.gov/grants/guide/notice-files/NOT-OD-03-032.html, National Institutes of Health Accessed: 23 August 2011; (2011) Chapter VI.D.4. Award and Administration Guide, , http://www.nsf.gov/pubs/policydocs/pappguide/nsf11001/aag_6.jsp#VID4, National Science Foundation Accessed: 23 August 2011; (2011) Availability of Data and Materials, , http://www.nature.com/authors/policies/availability.html, Nature Publishing Group Accessed: 24 August 2011; Nelson, B., Empty archives (2009) Nature, 461 (7261), pp. 160-163; Pincent, E., (2009) The AIDA Self-assessment Toolkit: Mark II, February 2009, , London: University of London Computer Centre; Pincent, E., (2010) Adapted AIDA for IDMP. AIDA: A JISC Project. Blog, , http://aida.jiscinvolve.org/wp/2010/09/, September 29; Pincent, E., AIDA: A JISC Project, , http://aida.jiscinvolve.org/wp/toolkit/, Accessed: 16 December 2010; Department Of Energy, U., (2010) Scientific and Technical Information Management., , DOE O 241.1B; Witt, M., Carlson, J., Brandt, D.S., Cragin, M.H., Constructing data curation profiles (2009) The International Journal of Digital Curation, 3 (4), pp. 93-103",Review,Scopus
"Ho Z.-P.","Application of food and beverage blog for setting metadata of digital archives - A value added aspect",2011,"International Journal of Information Processing and Management",2,2,,139,144,,3,"http://www.scopus.com/inward/record.url?eid=2-s2.0-79960138219&partnerID=40&md5=1a22c6657b2ee3cefb25a6406da13fdf","A digital archive is a digital database, which is built by the internet, websites' culture and information techniques. In digital archives, there's a high correlation between documental connotation and information techniques, especially in historically cultural information. Numerous institutions archives are going digitalized. People are able to access digital archives information, even if seldom people could access the original. However, on the current artificial intelligence methodology, it is still a hard problem to describe a story for humans after computer reading mass information. At this moment, if we can gather a lot of friends from the internet, discussing valuable photos, articles or videos from blogs, such as food and beverage blog, then, it would form a popular approach to set up a metadata. This paper offers this new concept to illustrate the new ideas, hoping that it can reduce the gap between current techniques and a willingness to create new ones. It also could create new meanings of knowledge management and cultural development.","Digital archive; Digital library; Food and Beverage Blog; Metadata",,"Han, B.D., (2000) Theory and practice of display planning, , Farm City Cultural press; Chen, B.X., Hong, C.X., (2001) Virtual display of model, concept and system in digital museum, pp. VII1-VII19. , Conference of Trends of Digital Library and Digital Museum in New Century papers, National Chiao-Tung University, Xin-Zhu City, Taiwan, Republic of China, Nov. 1; Pikas, C.K., BLOG searching for competitive intelligence, brand image and reputation management (2005) Online, 29 (4), pp. 16-21; Perng, C., Chiou, W.C., Pan, Y.L., Ho, Z.P., Tsai, J.T., Chen, H.X., (2005) Decision making model for websites evaluation- A study of travel websites, (26), pp. 1-10. , 2005 Conference on Technology and Management of Taiwan papers, National Taipei University of Technology, Taipei City, Taiwan, Republic of China, Nov. 11; Wu, C.S., Perng, C., Ho, Z.P., The application of wireless network in mobile commerce, Symposium on Applications of Information (2005) Shu-Te University of Technology, Kaoshiung County, Taiwan, Republic of China, (36), pp. 1-9; Terwiesch, C., Loch, C.H., Collaborative prototyping and the pricing of custom-designed products, MS (2004) MS (Management Science), 50 (2), pp. 145-159; Dean, D., Xiao, X.H., (2006) Museum exhibition theory and practice, pp. 149-182. , Artists of Taiwan press; Lin, G.L., Ye, J.H., Ouyang, Y.Z., (2001) The application of knowledge database in digital library, pp. X1-X16. , Conference of Trends of Digital Library and Digital Museum in New Century papers, National Chiao-Tung University, Xin-Zhu City, Taiwan, Republic of China, Nov. 1; Fan, J.W., Ho, J.M., Lee, D.C., (2001) The standard of metadata design- A digital archive exchange aspect, pp. IX1-IX11. , Conference of Trends of Digital Library and Digital Museum in New Century papers, National Chiao-Tung University, Xin-Zhu City, Taiwan, Republic of China, Nov. 1; Jan, L.P., (2001) The application of E-metrics on digital library evaluation, pp. II1-II9. , Conference of Trends of Digital Library and Digital Museum in New Century papers, National Chiao-Tung University, Xin-Zhu City, Taiwan, Republic of China, Nov. 1; Chou, M., (2006) The policy of digital archive in museum, pp. 29-45. , Conference of Collection Policy of Moderate Museum papers, National Museum of Natural ScienceTaichung City, Taiwan, Republic of China, Dec; Mitrovic, M., Tadic, B., Bloggers behavior and emergent communities in Blog space, EPJB (2010) EPJB (European Physical Journal B), 73 (2), pp. 293-301; Wang, M.Y., (2001) Museum in digital torrents: A view of the future from the historical perspective, pp. VI1-VI10. , Conference of Trends of Digital Library and Digital Museum in New Century papers, National Chiao-Tung University, Xin-Zhu City, Taiwan, Republic of China, Nov. 1; Cayzer, S., Semantic blogging and decentralized knowledge management, CACM (2004) CACM(Communications of the ACM), 47 (12), pp. 47-52; Cheng, S.C., Huang, K.P., Chen, Y.C., The search engine for articles and multimedia in blogs, LNAI (2008) LNAI (Lecture Notes in Artificial Intelligence), (5353), pp. 758-767; Han, S.K., Shin, D., Jung, J.Y., Park, J., Exploring the relationship between keywords and feed elements in blog post search (2010) World Wide Web, 12 (4), pp. 381-398; Wang, S.S., (2005) Evolution of preservation and maintain in log of indigenous specimen on Taiwan-National Natural Science Museum as an example, pp. 79-100. , Nationa Taiwan Museum press; http://zh.wikipedia.org, WikiWang, Y.F., (2005) Acquisition of and Access to Scientific and Technical Archives, pp. 88-105. , National Science and Technology Museum of Taiwan press; Chen, Y.N., Chen, S.J., Chang, Y.T., Lin, S.C., (2001) A metadata lifecycle for content analysis in digital libraries, pp. V1V-15. , Conference on Digital Library of Taiwan papers, National Chiao-Tung University, Xin-Zhu City, Taiwan, Republic of China, Nov. 1; Ho, Z.P., Perng, C., (2005) Applying bayesian networks learning to content analysis of advertising webPages, (59), pp. 1-6. , CIIE, CIIE (The Chinese Institute of Industrial Engineers Conference papers)Chung-Hua University, Xin-Zhu City, Taiwan, Republic of China, Dec. 17; Ho, Z.P., Perng, C., (2005) Planning retreat route of mountaineering by personal digital assistant, pp. 217-228. , National Mountaineering Conference papers, Shei-Pa National Park, Maioli county, Taiwan, Republic of China, Nov. 13; Ho, Z.P., Perng, C., Lee, M.D., (2005) Intelligent remote customer service system for logistics, pp. 1-7. , Theory and Practice of 2005 Industry Globalization for Logistics Management Conference on Taiwan papers, Tung-Fang Institute, Kaoshiung County, Taiwan, Republic of China, May 13; Ho, Z.P., Perng, C., Chiou, W.C., (2003) The analysis and design of computer aided employee skill evaluation system, 4 (3), pp. 1-5. , The First National Chin-Yi Institute of Technology on Management Conference papers, National Chin-Yi University of Technology, Tai-Ping City, Taichung County, Republic of China, Dec. 20; Ho, Z.P., Chiou, W.C., Perng, C., Ni, W.C., (2004) Applying information extraction technique to the web content analysis, (131), pp. 1-10. , 5th Conference on Management Theory and Practice of Electronic Business papersDa-Yeh University, Zhang-Hua County, Taiwan, Republic of China, May 22; Lee, Z.Y., Lin, Y.H., (2007) A long term preservation of digital archive and quality control, pp. 76-95. , Conference of Quality Control in Digital Archive papers, Academia Sinica, Taipei City, Taiwan, Republic of China, Nov. 21",Article,Scopus
"Mohsenzadeh F., Isfandyari-Moghaddam A.","Perceptions of library staff regarding challenges of developing digital libraries: The case of an Iranian university",2011,"Program",45,3,,346,355,,1,"http://www.scopus.com/inward/record.url?eid=2-s2.0-79960620449&partnerID=40&md5=7535b0405e47d7175cc9c875bbfd8e64","Purpose: The present research aims to identify the difficulties and obstacles for developing digital libraries in the seven regional branches of Islamic Azad University (IAU), Iran, and to study the status of librarians' skills and education programmes at these institutions. Design/methodology/approach: The 40 individuals working in the regional branch libraries of IAU were surveyed by a questionnaire consisting of 34 questions, and the collected data were analysed using SPSS software (version 16). Findings: It was found that the most important difficulties are the lack of suitable equipment and untrained personnel (i.e. a lack of sufficient training programmes). Research limitations/implications: Because of the small number of participants, it is suggested that a larger scale study is carried out. It is also proposed that the suggestions made by the participants will be considered and implemented, based on the digital library (DL) developments in academic libraries in different countries. Practical implications: It is expected that with improved library management, and the solving of the problems highlighted, through suitable training programmes, librarians will contribute more actively and effectively in establishing and managing DLs in the surveyed libraries. Originality/value: This research can contribute to existing knowledge in the areas of information technology and digital library management, especially in academic arenas. The paper helps librarians do their best in the new environments. © Emerald Group Publishing Limited.","Academic libraries; Digital libraries; Employee assistance programmes; Information technology; Internet; Iran; Librarians; Library management; Workplace training",,"Abifarin, F., Availability and use of information technologies in Nigerian university libraries (1993) Library Review, 42 (5), pp. 4-14; Aqili, S.V., Isfandyari-Moghaddam, A., Bridging the digital divide: The role of librarians and information professionals in the third millennium (2008) The Electronic Library, 26 (2), pp. 226-237; Bawden, D., Vilar, P., Zabukovec, V., Education and training for digital librarians: A Slovenia/UK comparison (2005) Aslib Proceedings: New Information Perspectives, 57 (1), pp. 85-98; Chowdhury, G., Chowdhury, S., (2003) Introduction to Digital Libraries, , Facet, London; Cleveland, G., (1998) Digital libraries: Definitions, Issues and challenges, , http://ifla.queenslibrary.org/VI/5/op/udtop8/udt-op8.pdf, Occasional Paper No. 8, IFLA Universal Dataflow and Telecommunications Core Programme, IFLA, Ottawa, available at(accessed 3 February 2011); Deegan, M., Tanner, S., (2002) Digital Futures: Strategies for the Information Age, , Library Association Publishing, London; Fadaei, G., Copyright in digital environment (2006) Journal of Information Science and Technology, 22 (1), pp. 18-129. , (in Persian); Fayyazi, E., Digital libraries and evolution in researches (2005) Journal of Abrar, 23 (4), pp. 42-51. , (in Persian); Igwe, P.O., The electronic age libraries: Present and future prospects (1986) International Library Review, 18 (1), pp. 75-84; Isfandyari-Moghaddam, A., Managing digital libraries in the light of staff and users: An approach (2009) International Journal of Information Science and Management, 7 (1), pp. 31-40; Isfandyari-Moghaddam, A., Bayat, B., Digital libraries in the mirror of the literature: Issues and considerations (2008) The Electronic Library, 26 (6), pp. 844-862; Kavulya, J.K., Digital libraries and development in sub-Saharan Africa: A review of challenges and strategies (2007) The Electronic Library, 25 (3), pp. 299-315; Marcum, D.B., Research questions for the digital era library (2003) Library Trends, 51 (4), pp. 636-651; Marion, L., (2001) Digital librarian, cybrarian, or librarian with specialized skills? Who will staff digital libraries?, , http://0-www.ala.org.sapl.sat.lib.tx.us/ala/mgrps/divs/acrl/events/pdf/marion.pdf, paper presented at the Association of College and Research Libraries, 10th Conference, Denver, CO, available at (accessed 3 February 2011); Mohsenzadeh, F., Isfandyari-Moghaddam, A., Application of information technologies in academic libraries (2009) The Electronic Library, 27 (6), pp. 986-998; Saaty, T.L., Shih, H.S., Structures in decision making: On the subjective geometry of hierarchies and networks (2009) European Journal of Operational Research, 199 (3), pp. 867-872; Samiei, M., Managing the collection of electronic resources (2004) Faslname-Ye Ketab, 15 (3), pp. 70-82. , (in Persian); Sreenivasulu, V., The role of a digital librarian in the management of digital information systems (DIS) (2000) The Electronic Library, 18 (1), pp. 12-20; Tammaro, A.M., A curriculum for digital librarians: A reflection on the European debate (2007) New Library World, 108 (5-6), pp. 229-246; Travica, B., Organizational aspects of the virtual library: A survey of academic libraries (1999) Library and Information Science Research, 21 (2), pp. 173-203; Yamazaki, H., Changing society, role of information professional and strategy for libraries (2007) IFLA Journal, 33 (1), pp. 50-58; Zhou, Q., The development of digital libraries in China and the shaping of digital librarians (2005) The Electronic Library, 23 (4), pp. 433-441",Article,Scopus
