Authors,Title,Year,Source title,Volume,Issue,Art. No.,Page start,Page end,Page count,Cited by,Link,Abstract,Author Keywords,Index Keywords,References,Document Type,Source
"Manzuch Z.","Monitoring digitisation: Lessons from previous experiences",2009,"Journal of Documentation",65,5,,768,796,,5,"http://www.scopus.com/inward/record.url?eid=2-s2.0-70350308059&partnerID=40&md5=56c4738008ab1ea7be1c5426f1165e02","Purpose: The purpose of this paper is to evaluate current approaches to assessing digitisation activities in memory institutions. Design/methodology/approach: Qualitative and quantitative analysis of digitisation surveys were performed. Analysis concentrated on several themes: general methodological solutions, digitisation objectives, users and usage of digitised content, budgeting and costs of digitisation, and volume and growth of digitised collections. Findings: Analysis revealed an absence of sound methodology solutions, issues of constructing a sample, the split between strategic and resource management approaches to digitisation, low visibility of user related evaluation criteria, and problems in developing quantitative measures. Research limitations/implications: Approaches to evaluating digitisation are not restricted to digitisation surveys and to provide a more comprehensive analysis these should be complemented by other data (e.g. interviews of digitisation experts). The identification of surveys was limited by subjective factors such as knowledge of national experts, visibility of reports on the web, and language of publication. Practical implications: The paper assists in the development of digitisation surveys by highlighting previous gaps and achievements. Originality/value: The paper is a first attempt to comprehend approaches to monitoring digitisation internationally. Gaps and issues identified in the research can guide studies on developing indicators and measures for specific digitisation activities. © Emerald Group Publishing Limited.","Digital libraries; Europe; European Union; Resource management",,"(2004) A Guide to European Group on Museum Statistics, , www.smb.spk-berlin.de/ifm/dokumente/materialien/IfM_001-202_WEB.pdf, European Group on Museum Statistics, available at:, (accessed 26 June 2008); (2003) ASERL Survey of Member Digitization Activities/Collections, , www.aserl.org/projects/digitization/ASERL_Digitization_Survey-Digitization_Mgrs.pdf, ASERL, available at:, (accessed 26 June 2008); Astle, P.J., Muir, A., Digitization and preservation in public libraries and archives (2002) Journal of Librarianship and Information Science, 34 (2), pp. 67-79; Bazerman, C., Prior, P., (2004) What Writing Does and How It Does It: An Introduction to Analyzing Text and Textual Practices, , Lawrence Erlbaum Associates, Mahwah, NJ and London; Besser, H., Digital image distribution: A study of costs and uses (1999) D-Lib Magazine, 5 (10). , www.dlib.org/dlib/october99/10besser.html, available at, (accessed 26 June 2008); Besser, H., (2003) Introduction to Imaging: Revised Version, , www.getty.edu/research/conducting_research/standards/introimages/, available at, (accessed 1 October 2008); Buckland, M., Information as thing (1991) Journal of the American Society for Information Science, 42 (5), pp. 351-60; Bultmann, B., Hardy, R., Muir, A., Wictor, C., (2005) Digitised Content in the UK Research Library and Archives Sector, , www.jisc.ac.uk/uploaded_documents/JISC-Digi-in-UK-FULL-v1-final.pdf, available at:, (accessed 26 June 2008); (2008) Canadian Heritage Information Network, , www.chin.gc.ca/English/index.html, Canadian Heritage Information Network, available at, (accessed 1 October 2008); Cathro, W., Digitization in Australasia (2007) The Journal for the Serials Community, 20 (1), pp. 9-15; (2005) I2010: Digital Libraries, , http://ec.europa.eu/information_society/activities/digital_libraries/doc/communication/en_comm_digital_libraries.pdf, Commission of the European Communities, Communication from the Commission to the European Parliament, the Council, the European Economic and Social Committee and the Committee of the Regions Commission of The European Communities, Belgium, available at:, (accessed 26 June 2008); (2003) Moving Theory into Practice: Digital Imaging Tutorial, , www.library.cornell.edu/preservation/tutorial/contents.html, Cornell, available at:, (accessed 1 October 2008); Coyle, K., Mass digitization of books (2006) The Journal of Academic Librarianship, 32 (6), pp. 641-5; Learning objects from cultural and scientific heritage resources (2003) DigiCULT, , www.digicult.info/downloads/digicult_thematicissue4_hres.pdf, DigiCULT, No. 4, available, (accessed 1 October 2008); Virtual communities and collaboration in the heritage sector (2004) DigiCULT, , www.digicult.info/downloads/digicult_thematicissue5_january_2004.pdf, DigiCULT, No. 5, available at:, (accessed 1 October 2008); (2008) Digital Libraries Initiative: Cultural Heritage, , http://ec.europa.eu/information_society/activities/digital_libraries/cultural/index_en.htm, Digital Libraries Initiative, available at:, (accessed 1 October 2008); (2006) DLF-Aquifer Services Institutional Survey Report: Aquifer Services Working Group Report on the Institutional User-Services Survey Results, , www.diglib.org/aquifer/SWGisrfinal.pdf, DLF-Aquifer Services, available at:, (accessed 26 June 2008); Dorner, D.D., Chawner, B., Searle, S., (2002) Creating a Digital Babylon? Results of a Survey of Digitization Activities in New Zealand, , www.natlib.govt.nz/downloads/Survey_of_digitisation_in_New_Zealand_2002.pdf, available at, (accessed 20 September 2008); Easton, V.J., McColl, J.H., (1997) Statistics Glossary, , www.stats.gla.ac.uk/steps/glossary/, available at:, (accessed 27 June 2008); Ebbon, R., Gould, S., (1999) IFLA/UNESCO Survey on Digitization and Preservation, , http://portal.unesco.org/ci/en/files/2172/11715367541Survey.doc/Survey.doc, available at:, (accessed 26 June 2008); (2000) EQUINOX: Definition of Electronic Library Performance Indicators, , http://equinox.dcu.ie/reports/pilist.html, EQUINOX: Definition of Electronic Library Performance Indicators, available at:; Commission recommendation of 24 August 2006 on the digitisation and online accessibility of cultural material and digital preservation (2006) Official Journal of the European Union, L236, pp. 28-30. , http://ec.europa.eu/information_society/activities/digital_libraries/doc/recommendation/recommendation_august06/en.pdf, European Commission, available at:, (accessed 26 June 2008); Council Conclusions on the Digitisation and Online Accessibility of Cultural Material, and Digital Preservation (2006) Official Journal of the European Union, C297, pp. 1-5. , http://eur-lex.europa.eu/LexUriServ/LexUriServ.do?uri1/4OJ:C:2006:297:0001:0005:EN:PDF, European Commission, available at; (2008) Europe's Cultural Heritage at the Cick of a Mouse: Progress on the Digitisation and Online Accessibility of Cultural Material and Digital Preservation Across the EU, , http://ec.europa.eu/information_society/activities/digital_libraries/doc/communications/progress/communication_en.pdf, European Commission, European Commission, Brussels, available at:, (accessed 1 October 2008); (2008) What is the European Library?, , www.theeuropeanlibrary.org/portal/organisation/about_us/aboutus_en.html#what_is_the_european_library, (The) European Library, available at:, (accessed 1 October 2008); Glosiene, A., Manzhukh, Z., Towards a usability framework for memory institutions (2005) New Library World, 7-8, pp. 303-19; Hsieh, H.-F., Shannon, S.E., Three approaches to qualitative content analysis (2005) Qualitative Health Research, 15 (9), pp. 1277-88; (2002) Guidelines for Digitisation Projects: for Collections and Holdings in the Public Domain, Particularly Those Held by Libraries and Archives, , www.ifla.org/VII/s19/pubs/digit-guide.pdf, IFLA, available at:, (accessed 1 October 2008); (2003) Assessment of End-User Needs in IMLS-Funded Digitization Projects, , www.imls.gov/pdf/userneedsassessment.pdf, IMLS, available at:, (accessed 26 June 2008); (2006) Status of Technology and Digitization in the Nation's Museums and Libraries, Institute of Museum and Library Services, , TechDig05/Technology%2BDigitization.pdf, IMLS, available at:, (accessed 26 June 2008); (1998) ISO 11620:1998 - Information and Documentation - Library Performance Standards, , ISO, ISO, Geneva; (2006) ISO 2789 - Information and Documentation - International Library Statistics, , ISO, ISO, Geneva; Kingma, B.R., The costs of print, fiche, and digital access: The Early Canadiana project (2000) D-Lib Magazine, 6 (2). , www.dlib.org/dlib/february00/kingma/02kingma.html, available at:, (accessed 26 June 2008); Krippendorff, K., (2004) Content Analysis: An Introduction to its Methodology, , Sage Publications, Thousand Oaks, CA; (1998) Substituting Images for Books: the Economics for Libraries, , www.lesk.com/mlesk/unlv/unlv.html, Lesk, M., available at:, (accessed 26 June 2008); (2008) LibQUAL+ TM - Charting Library Service Quality, , www.libqual.org/, LibQUAL, available at:, (accessed 26 June 2008); (2001) The Lund Principles: Conclusions of Expert Meetings, Lund, , ftp://ftp.cordis.europa.eu/pub/ist/docs/digicult/lund_principles-en.pdf, (The) Lund Principles, available at:, (accessed 1 October 2008); Manžuch, Z., (2007) An Analysis of the State-of-the-art in Measuring the Progress of Digitisation of Cultural Materials, , www.numeric.ws/uploaded_files/NUMERIC_Desktop_Research_on_Digitisation_Studies26102007114936.pdf, available at:, (accessed 26 June 2008); Manžuch, Z., Knoll, A., (2006) Research Activities of the European National Libraries in the Domain of Cultural Heritage and ICT, , www.theeuropeanlibrary.org/portal/organisation/cooperation/archive/telmemor/docs/D1.3_research_activities_report.pdf, available at:, (accessed 13 May 2008); (2008) Handbook on Cultural Web User Interaction, MINERVA EC Working Group Quality, Accessibility and Usability, , www.minervaeurope.org/publications/Handbookwebuserinteraction.pdf, MINERVA EC, available at:, (accessed 20 September 2008); Mugridge, R.L., (2006) Managing Digitization Activities, , www.arl.org/bm~doc/spec294web.pdf, available at:, (accessed 26 June 2008); Amazon digitize historic films (2007) The Information Management Journal, p. 19. , NARA, December/November; Neuendorf, K.A., (2002) The Content Analysis, , Guidebook, Sage Publications, Thousand Oaks, CA; (2002) The NINCH Guide to Good Practice in the Digital Representation and Management of Cultural Heritage Materials, , www.nyu.edu/its/humanities/ninchguide/, NINCH, available at:, (accessed 1 October 2008); (2008) Numeric, , www.numeric.ws/, NUMERIC, available at:, (accessed 26 June 2008); Poll, R., de Boekhorst, P., (1996) Measuring Quality: International Guidelines for Performance Measurement in Academic Libraries, , K.G. Saur, Munchen, New Providence, London and Paris; Poll, R., Jönsson-Adrial, C., (2006) Performance Indicators for National Libraries, , www.ifla.org/VII/s1/pub/s1-PerformanceIndicators2006.pdf, available at:, (accessed 26 June 2008); (2004) Preservation Project Cost Calculator, Prestospace, , http://prestospace-sam.ssl.co.uk/hosted/d13.2/newcalc.php/, Prestospace, available at:, (accessed 26 June 2008); Puglia, S., The costs of digital imaging projects (1999) RLG DigiNews, 3 (5). , http://webdoc.gwdg.de/edoc/aw/rlgdn/preserv/diginews/diginews3-5.html#feature, available at:, (accessed 26 June 2008); Rayward, B., Electronic information and the functional integration of libraries, museums and archives (1998) History and Electronic Artifacts, pp. 207-26. , in Higgs, E. (Ed.), Clarendon, Oxford; Smith, A., (2001) Strategies for Building Digitised Collections, , www.clir.org/pubs/reports/pub101/pub101.pdf, available at:, (accessed 1 October 2008); Tanner, S., Handbook on cost reduction in digitisation (2006) Minerva, , www.minervaeurope.org/publications/costreduction.htm, available at:, (accessed 26 June 2008); Tanner, S., Smith, J.L., Digitisation: How much does it really cost (1999) Higher Education Digitisation Service, , http://digitalarchive.oclc.org/da/ViewObjectMain.jsp;jsessionid1/484ae0c5f8240a4914c4f3bca4b79acbec6c0a2334c21?fileid1/40000070519:000006286417&reqid1/4766, available at:, (accessed 26 June 2008); (2001) Assessing the Costs of Conversion: Making America IV: The American Voice 1850-1876. A Handbook Created for the Andrew W. Mellon Foundation, , www.lib.umich.edu/lit/dlps/pubs/moa4_costs.pdf, University of Michigan, available at:, (accessed 26 June 2008); (2002) A Study of Business Models Sustaining the Development of Digital Cultural Content, Wall Communications, Ottawa, , www.canadianheritage.gc.ca/progs/pcce-ccop/reana/model-study.pdf, Wall Communications, available at:, (accessed 20 September 2008); Witthaut, D., (2005) Digitalisierung und Erhalt von Digitalisaten in Deutschen Museen, , www.langzeitarchivierung.de/downloads/mat/nestor_mat_02.pdf, available at:, (accessed 26 June 2008); Zorich, M.D., (2003) A Survey of Digital Cultural Heritage Initiatives and Their Sustainability Concerns, , www.clir.org/pubs/abstract/pub118abst.html, available at:; Zuraidah, A.M., The state of digitisation initiatives by cultural institutions in Malaysia: An exploratory survey (2007) Library Review, 56 (1), pp. 45-60",Article,Scopus
"Gosina L.I., Maslyak T.I., Pogorelko K.P.","Creation of a topical electronic scientific library: Problems and solutions",2008,"Scientific and Technical Information Processing",35,4,,181,187,,,"http://www.scopus.com/inward/record.url?eid=2-s2.0-78651530543&partnerID=40&md5=c934b2473f485bd8ac4eb2385be216fd","Access to information and the filling of RuNet with electronic collections and libraries, including those created within the institutions of the RAN (Russian Academy of Sciences) are considered. The stages in the creation of an electronic library on the basis of a traditional library are described; several projects for the organization of electronic libraries and the independent development of a program package for editing, archiving, presentation and searching for fragments in an electronic text are cited. © Allerton Press, Inc. 2008.",,"Access to information; Electronic library; Program packages; Russian Academy of Sciences; Libraries; Societies and institutions; Software packages; Digital libraries","Zemskov, A.I., Shraiberg, Ya.L., (2003) Elektronnye Biblioteki (Electronic Libraries), , Moscow: Libereya; Kachalina, V.V., ""Electronic Collection"" or ""Electronic Fund""?"" (by expert survey) (2006) Bibliotekovedenie, (1), pp. 55-61; Gosina, L.I., Electronic Scientific Publications of the Russian Academy of Sciences in the Information Space (2007) Kniga: Issledovaniya I Materialy (Book: Studies and Materials), 87 (PART 2), pp. 30-48; Gosina, L.I., Maslyak, T.I., Pogorelko, K.P., (2006) Development of the System of Services in a Topical Academic Library: Electronic Loan System, (11), pp. 33-36. , NTI, Ser. 1; Kalenov, N.E., Savin, G.I., Sotnikov, A.N., Electronic Library ""Russia's Scientific Legacy"": Technology of Acquisitions (2007) Novye Tekhnologii V Informatsionnom Obespechenii Nauki (New Technologies in Services to Science), pp. 40-48. , in Proceedings of the 12th seminar, BEN RAN, ed. N.E. Kalenov, Moscow: Nauchnyi Mir; Pogorelko, K.P., Creation of Full Text Data Base in the Library of the Steklov Mathematical Institute (2005) Informatsionnoe Obespechenie Nauki: Novye Tekhnologii (Information Services to Science), , RAN, in Moscow; Nesterenko, A.K., Sysoev, T.M., Pogorelko, K.P., Implementation of Electronic Library ""Russia's Scientific Legacy"" As Distributed Information System (2007) Novye Tekhnologii V Informatsionnom Obespechenii Nauki (New Technologies in Services to Science), pp. 276-287. , in Proceedings of the 12th seminar, BEN RAN, Moscow: Nauchnyi Mir",Article,Scopus
"Belcher E., Sexton E.","Digitizing criminals: Web delivery of a century on the cheap",2008,"OCLC Systems and Services",24,2,,116,132,,1,"http://www.scopus.com/inward/record.url?eid=2-s2.0-44949096524&partnerID=40&md5=b34f2f907656b21d3d813437061aafaa","Purpose - The purpose of this paper is to present the process, challenges and lessons learned from carrying out a small digital project to create a web resource of unique historic materials related to crime in New York City. All aspects of digital project management are discussed, including selection, infrastructure, budgeting, workflow and delivery. Design/methodology/approach - Experiences from project administration, including management of a combination in-house and outsourced digitization and metadata are discussed. Formation and management of the resulting web resource is explained, which is the product of a creative amalgamation of commercial and open source software. Challenges encountered are presented with suggestions for practical solutions and considerations for future projects. Findings - This grant-funded pilot project presented foreseen and unforeseen problems. Lessons learned and solutions suggesting best approaches for a small-scale digitization project are presented here. Practical implications - In this paper best practices and suggestions for managing a small digital project are presented, including financial, staffing and technical considerations. Originality/value - Unlike many other discussions that focus on management of large institutional projects, this study presents an incremental approach for small-scale digitization projects. Presented here are practical uses of available applications for establishing project infrastructure to sustain and continue growth of digital content for small institutions.","Academic libraries; Criminal justice; Digital libraries; Photographs; Project management; Trials",,"Blumenthal, R., (2004) Miracle at Sing Sing: How One Man Transformed the Lives of America's Most Dangerous Prisoners, , St Martin's Press New York, NY; (2006) Dublin Core Metadata Best Practices, , www.cdpheritage.org/cdp/documents/CDPDCMBP.pdf, CDP Metadata Working Group Version 2.1.1, available at:; Chauncey, G., (1994) Gay New York: Gender, Urban Culture, and the Making of the Gay Male World, 1890-1940, , Basic Books New York, NY; Donovan, B., ""Gender inequality and criminal seduction: Prosecuting sexual coercion in the early 20th century"" (2005) Law & Social Inquiry, 30 (2), pp. 61-88; Egan, N., ""The Lloyd Sealy Library of John Jay College of Criminal Justice: Academic library, special library, or both?"" (2007) Behavioral & Social Sciences Librarian, 25 (2), pp. 1-22; Faber, E., Rowland, E., (1989) Trial Transcripts of the County of New York, 1883-1927: A Historical Introduction With an Index to the Microfilm Collection, , www.lib.jjay.cuny.edu/info/speccoll/Trialtranscriptspamphlet2.pdf, John Jay Press New York. NY; Goewrey, D., (2006) Crash Out: The True Tale of a Hell's Kitchen Kid and the Bloodiest Escape in Sing Sing History, , Crown New York, NY; MacKellar, L., (2006) The ""Double Indemnity"" Murder: Ruth Snyder, Judd Gray, and New York's Crime of the Century, , Syracuse University Press New York, NY; Robertson, S., (2005) Crimes Against Children: Sexual Violence and Legal Culture in New York City 1880-1960, , University of North Carolina Press Chapel Hill, NC; Turkus, B., Feder, S., (1951) Murder Inc.; The Story of ""the Syndicate"", , Farrar, Straus and Young New York, NY; (2003) Western States Digital Imaging Best Practices, , www.cdpheritage.org/digital/scanning/documents/WSDIBP_v1.pdf, Western States Digital Standards Group, Digital Imaging Working Group Version 1.0., available at:; Witten, I.H., ""Creating and customizing digital library collections with the Greenstone librarian interface"" (2004) Proceedings of the International Symposium on Digital Libraries and Knowledge Communities in Networked Information Society (DLKC'04), pp. 97-104. , www.kc.tsukuba.ac.jp/dlkc/e-proceedings/papers/dlkc04pp97.pdf, Tsukuba, Ibaraki, Japan available at:; Witten, I.H., Bainbridge, D., (2003) How to Build a Digital Library, , Morgan Kaufmann San Francisco, CA; Witten, I., Bainbridge, D., Boddie, S., Greenstone: Open-source digital library software (2001) D-lib Magazine, 7 (10). , http://dlib.anu.edu.au/dlib/october01/witten/10witten.html, available at:",Article,Scopus
"SuKantarat W.","Digital initiatives and metadata use in Thailand",2008,"Program",42,2,,150,162,,,"http://www.scopus.com/inward/record.url?eid=2-s2.0-43449116672&partnerID=40&md5=cb18838207130788d9d9afe9b23160e2","Purpose - This paper aims to provide information about various digital initiatives in libraries in Thailand and especially use of Dublin Core metadata in cataloguing digitized objects in academic and government digital databases. Design/methodology/approach - The author began researching metadata use in Thailand in 2003 and 2004 while on sabbatical from the University of Vermont. A small number of government libraries were in the process of building up their digital databases. These were identified from a survey conducted by the author at that time. The author continues to monitor the development of digital initiatives and has identified several new digital initiatives created by academic institutions since then. The digital initiatives operated by Thai government agencies and academic institutions that existed in 2007 are presented, along with one example of a metadata record randomly selected from each of these projects. These examples illustrate Dublin Core metadata use and cataloguing practice employed in these digital databases. The author's current research on the development of digital initiatives is included. Findings - This paper presents what the author feels are some significant technical and legal issues facing Thai digital initiatives. A major copyright issue in Thailand, the ineffective enforcement of intellectual property laws relating to access rights, is presented. Also discussed is the significant obstacle to record retrieval created by the structure and complexity of the Thai language. Originality/value - This paper identifies important issues and problems related to Thai digital initiatives and offers suggestions and comments aimed at enhancing the development and progress of digital initiatives both in the Thai library community and internationally. © Emerald Group Publishing Limited.","Cataloguing; Data collection; Digital libraries; Libraries; Thailand",,"Beall, J., (2005) Metadata and Data Quality Problems in the Digital Library, , http://journals.tdl.org/jodi/article/view/jodi-171/68, University of Colorado at Denver and Health Sciences Centre, Denver; Siripan, P., Creating vocabulary for Thai database integration (2005) DC-2005, International Conference on Dublin Core metadata and applications, , paper presented, Madrid, September 12-15, 2005, available at: http://dublin.tiac.or.th/doc/DC2005-Thailand.pdf; Tiac, (2006) Annual Reports, , www.tiac.or.th/about%20tiac1report.html, Technical Information Access Center, Prathumthani; Gorman, G.E., Cullen, R., The knowledge model applied to library networks in Asia (2000) Library Consortium Management: An International Journal, 2 (7), pp. 135-44; Siripan, P., Metadata and trends of cataloging in Thailand (1999) 65th IFLA Council and General Conference, , paper presented, August 20-28, 1999, Bangkok, available at: www.ifla.org/IV/ifla65/papers/114-131e.htm",Article,Scopus
