Authors,Title,Year,Source title,Volume,Issue,Art. No.,Page start,Page end,Page count,Cited by,Link,Abstract,Author Keywords,Index Keywords,References,Document Type,Source
"Ortiz-Repiso V., Bazan V., Ponsati A., Cottereau M.","How researchers are using the OPAC of the Spanish Council for Scientific Research library network",2006,"Electronic Library",24,2,,190,211,,6,"http://www.scopus.com/inward/record.url?eid=2-s2.0-33745855849&partnerID=40&md5=1f5799e55dde093bc3f55563bba3778b","Purpose - The importance of online public access catalogues (OPACs) has changed in recent years, mainly due to the large number of electronic resources now available. The aim of this study is to learn about and evaluate the use made by researchers of the OPAC of the library network of the Spanish Council for Scientific Research, the largest research institution in Spain. Design/methodology/approach - To this end a quest ionnaire was drafted with questions pertaining both to the system and to the users themselves. The information gathered was supplemented by data obtained from the transaction logs. Findings - The results have revealed the use made of the OPAC and the characteristics of the searches performed. Users are still confronted by classic problems of information seeking: information overload, errors in subject searching, and the predominant use of the system's simpler options. The results show that the OPAC is broadly used by end-users not only for obtaining printed material, but also for connecting to the electronic resources subscribed to by the library. Originality/value - The OPAC should continue to occupy an important position in the library's overall information environment, interacting with other information systems. © Emerald Group Publishing Limited.","Online catalogues; Research organizations; Spain; User studies","Digital libraries; Information retrieval; Online searching; Research; Societies and institutions; Library network; Online public access catalogue (OPAC); Research organizations; Spain; Online systems","Borgman, C.L., ""Why are online catalogs hard to use? Lessons learned from information retrieval studies"" (1986) Journal of the American Society for Information Science, 37 (6), pp. 387-400; Borgman, C.L., ""Why are online catalogs still hard to use?"" (1996) Journal of the American Society for Information Science, 47 (7), pp. 493-503; Cochrane, P.A., Markey, K., ""Catalog use studies: Since the introduction of online interactive catalogs: Impact on design for subject access"" (1983) Library and Information Science Research, 5 (4), pp. 337-363; Davidson, L.A., ""Libraries and their OPACs lose out to the competition"" (1999) Library Computing, 18 (4), pp. 279-283; Delsey, T., ""The Library Catalogue in a Network Environment"" (2001) Proceedings of the Bicentennial Conference on Bibliographic Control for the New Millenium, Library of Congress, Washington, DC.; Halcoussis, D., Halverson, A.L., Lowenberg, A.D., Lowenberg, S., ""An empirical analysis of web catalog user experiences"" (2002) Information Technology and Libraries, 21 (4), pp. 148-157; Hildreth, C.R., ""Online public access catalog"" (1985) Annual Review of Information Science and Technology (ARIST), 20, pp. 232-285. , Williams, M.E. (Ed.) Knowledge Industrial, New York, NY; Hildreth, C.R., ""Accounting for users inflated assessments of on-line catalogue search performance and usefulness: An experimental study"" (2001) Information Research, 6. , httpp://informationr.net/ir/6-2/paper101.html, available at; Hunter, R.N., ""Successes and failures of patrons searching the online catalog at a large academic library: A transaction log analysis"" (1991) RQ, 30 (4), pp. 395-402; Large, A., Beheshti, J., ""OPAC's: A research review"" (1997) Library & Information Science Research, 19 (2), pp. 111-133; Larson, R., (1986) Workload Characteristics and Computer System Utilization in Online Library Catalogs, , University of California Berkeley, CA; Larson, R., ""Between scylla and charybdis: Subject searching in the online catalog"" (1991) Advances in Librarianship, pp. 175-236. , Godden, I. (Ed.), Academic Press, San Diego, CA; Larson, R., ""The decline of subject searching: Long-term trends and patterns of index use in online catalog"" (1991) Journal of the American Society for Information Science, 42 (1), pp. 93-104; Larson, R., ""Evaluating of advanced retrieval techniques in a experimental online catalog"" (1992) Journal of the American Society for Information Science, 43 (1), pp. 34-53; Novotny, E., ""I don't think I click: A protocol analysis study of use of a library online catalog in the Internet age"" (2004) College & Research Libraries, 65, pp. 527-537; Ortiz-Repiso, V., Moscoso, P., ""Web-based OPACs: Between tradition and innovation"" (1999) Information Technology and Libraries, 18 (2), pp. 68-77; Peters, T.A., (1991) The Online Catalog: A Critical Examination of Public Use, , McFarland & Company Jefferson, NC; Schwartz, J., ""Internet access and end-user needs: Computer use in an academic library"" (2002) Reference and User Services Quarterly, 41 (3), pp. 253-262; Webster, P., ""Metasearching in an academic environment"" (2004) Online, 28 (2), pp. 20-23; Yu, H., Young, M., ""The impact of web search engines on subject searching in OPAC"" (2004) Information Technology and Libraries, 23 (4), pp. 168-180",Article,Scopus
"Spence J.","Small organisations and cultural institutions - A digital future?",2005,"Program",39,4,,366,380,,,"http://www.scopus.com/inward/record.url?eid=2-s2.0-27844609825&partnerID=40&md5=44ebaf69f526f90fc2e7bdcb1d19d670","Purpose - This paper aims to examine how technology presents both problems and opportunities for the historian, the researcher, small organisations, and cultural heritage institutions. Ways of safeguarding historical material in digital form are suggested, and the role of cultural heritage bodies as managers of sustainable digital collections is examined. Design/methodology/approach - The tools available for online access to historical material are discussed, with some comparison made between current efforts on access provision and long-term preservation. Findings - At present, access to historical material in digital form is often given precedence over its preservation. This could have potentially serious long-term implications. Lack of funding for the traditional collecting bodies suggests that new mechanisms for dealing with digital archive collections need to be found. Managing digital material from its creation moves responsibility back to owners, but can provide a platform for effective transfer to new custodians at the appropriate time. Small organisations can participate, increasing the volume and diversity of available material, enriching the base of knowledge upon which history is created. Research limitations/implications - Further research is required into possible models to enable seamless transfer through the custodial chain. Limitation: lack of quantitative analysis of existing and planned digital preservation projects. Originality/value - The paper challenges the status quo and sets out some radical ideas concerning the creation, acquisition, management and preservation of digital records, and the roles of the key stakeholders in the cultural and historical domains. © Emerald Group Publishing Limited.","Archives management; Digital libraries; History; Small enterprises; United Kingdom",,"Beagrie, N., Preserving UK digital library collections (2001) Program, 35 (3), pp. 217-26; Beagrie, N., (2003) National Digital Preservation Initiatives: An Overview of Developments in Australia, France, the Netherlands, and the United Kingdom and of Related International Activity, , Council on Library and Information Resources, Library of Congress Washington, DC available at: www.clir.org/pubs/reports/pub116/contents.html (accessed 11 July 2005); Brand, S., (2000) The Clock of the Long Now, , Phoenix London; Crace, J., Digital dark age (2003) The Guardian, , 18 March, available at: http://education.guardian.co.uk/egweekly/story/0,915847,00.html (accessed 11 July 2005); Dalbello, M., Institutional shaping of cultural memory: Digital library as environment for textual transmission (2004) Library Quarterly, 74 (3), pp. 263-98; Everitt, S., Opportunistic collaboration: Unlocking the archives of the Birmingham Institute of Art & Design (2005) Program, 39 (4); Jones, M., Beagrie, N., (2001) Preservation Management of Digital Materials: A Handbook, , British Library London available at: www.dpconline.org/graphics/intro/index.html (accessed 11 July 2005); Kolbet, R.M., Publish & perish: Printed ephemera and social history (1991) Books at Iowa, 55, pp. 25-36. , available at: www.lib.uiowa.edu/spec-coll/Bai/kolbet3.htm (accessed 11 July 2005); Kurzweil, R., Fine living in virtual reality (2002) The Invisible Future: The Seamless Integration of Technology into Everyday Life, pp. 193-215. , Denning, P. McGraw-Hill New York, NY; Popper, K., (1966) The Open Society and Its Enemies: Vol. 2: The High Tide of Prophecy: Hegel, Marx and the Aftermath, , 5th ed. Routledge and Kegan Paul London; Powell, D., Scottish textile heritage online (2004) Dunaskin News: The Newsletter of the Glasgow University Archives Service, , 5 ed. available at: wwwarchivesglaacuk/about/dunaskin/2003-04/edition5/sthonline.html (accessed 11 July 2005)",Article,Scopus
"Arlitsch K., Jonsson J.","Aggregating distributed digital collections in the Mountain West Digital Library with the CONTENTdm™ multi-site server",2005,"Library Hi Tech",23,2,,220,232,,9,"http://www.scopus.com/inward/record.url?eid=2-s2.0-21344449711&partnerID=40&md5=d446baa773ae99c81231ee798d5bf347","Purpose - The purpose of this paper is to describe the creation of the Mountain West Digital Library (MWDL), a cooperative regional program distributed throughout Utah and Nevada. Its metadata are aggregated at a single web site. Six digitization centers at the largest universities in both states digitize their own collections and support partner institutions in their geographic regions. Each center runs a CONTENTdm server, and an aggregating server at the University of Utah harvests metadata into a single searchable index. Local control and identity of collections are hallmarks of the MWDL. Design/methodology/approach - This paper describes the technical structure of the MWDL, focusing on the multi-site server aggregating software from DiMeMa Inc. Findings - The MWDL was the first cooperative digital project to implement this software, and inspired the same infrastructure for a nine-state project known as the Western Waters Digital Library. In 2005 the MWDL will also become the first in the nation to aggregate distributed digital newspaper collections. Practical implications - Describes the creation and aggregation of a distributed regional digital library with digital asset management software that is already in use at over 200 institutions in the US. The solutions implemented in the MWDL offer a mechanism for large and small institutions to work together in a cost-effective manner. Originality/value - Examines the benefits and problems associated with creating a regional digital library. © Emerald Group Publishing Limited.","Digital libraries; Information retrieval; Software; United States of America",,"Bishoff, L., ""The collaboration imperative"" (2004) Library Journal, 129 (1), p. 34; Herbert, J., Artlitsch, K., ""Digitalnewspapers.org: The Utah digital newspapers program"" (2003) The Serials Librarian, 47 (1), p. 2",Article,Scopus
"Kwasnik B.H., Crowston K.","Introduction to the special issue: Genres of digital documents",2005,"Information Technology and People",18,2,,76,88,,29,"http://www.scopus.com/inward/record.url?eid=2-s2.0-20444454657&partnerID=40&md5=7f837ba0abecdace6100caca9611eda4","Purpose - To introduce the special issue on ""Genres of digital documents."" While there are many definitions of genre, most include consideration of the intended communicative purpose, form and sometimes expected content of a document. Most also include the notion of social acceptance, that a document is of a particular genre to the extent that it is recognized as such within a given discourse community. Design/methodology/approach - The article reviews the notion of document genre and its applicability to studies of digital documents and introduces the four articles in the special issue. Findings - Genre can be studied based on intrinsic genre attributes or on the extrinsic function that genre fulfills in human activities. Studies on intrinsic attributes include classifications of genres as clusters of attributes, though these classifications can be problematic because documents can be used in flexible ways. Also, new information technologies have enabled the appearance of novel genres. Studies on extrinsic function include ways to use genre for education or information accesses, as well as the use of genre as a lens for understanding communications in organizations. The four articles in the special issue illustrate these approaches. Originality/value - The paper provides a framework that organizes the range of research about genres of digital documents that should be helpful to those reading this research or planning their own studies. © Emerald Group Publishing Limited.","Classification; Digital libraries; Digital storage; Research","Classification (of information); Communication systems; Digital storage; Information technology; Professional aspects; Research; Social aspects; Societies and institutions; Digital documents; Discourse community; Social recognition; Digital libraries","Bagdanov, A., Worring, M., (2001) Fine-grained Document Genre Classification Using First Order Random Graphs, , paper presented at the Document Analysis and Recognition Conference, Seattle, WA, September; Bazerman, C., Systems of genres and the enactment of social intentions (1995) Genre and the New Rhetoric, pp. 79-101. , Freedman, A. Medway, P. Taylor & Francis London; Chapman, M.L., Situated, social, active: Rewriting genre in the elementary classroom (1999) Written Communication, 16 (4), pp. 469-490; Crowston, K., Williams, M., Reproduced and emergent genres of communication on the World-Wide Web (2000) The Information Society, 16 (3), pp. 201-216; Dillon, A., Gushrowski, B., Genres and the web: Is the personal home page the first uniquely digital genre? (2000) Journal of the American Society for Information Science, 5 (12), pp. 202-205; Erickson, T., Making sense of computer-mediated communication (CMC): Conversations as genres, CMC systems as genre ecologies (2000) Proceedings of the 33rd Hawaii International Conference on System Sciences (HICSS-33), Maui, HI, , IEEE Press Los Alamitos, CA, available at: www.pliant.org/personal/TomErickson/genreEcologies.html; Finneman, N.O., (2001) The Internet: A New Communicational Infrastructure, , 15th Nordic Conference on Media and Communication Research, University of Iceland, Reykjavik, August 11-13; Giddens, A., (1984) The Constitution of Society, , University of California Press Berkeley, CA; Karjalainen, A., Päivärinta, T., Tyrväinen, P., Rajala, J., Genre-based metadata for enterprise document management (2000) Proceedings of the 33rd Hawaii International Conference on System Sciences (HICSS-33), Maui, HI, , IEEE Press Los Alamitos, CA; Karlgren, J., Cutting, D., (1994) Recognizing Text Genres with Simple Metrics Using Discriminant Analysis, , Proceedings of 15th International Conference on Computational Linguistics, Kyoto; Kennedy, A., Shepherd, M., Automatic identification of home pages on the web (2005) Proceedings of the 38th Hawaii International Conference on System Sciences (HICSS-38), Big Island, HI, , IEEE Press Los Alamitos, CA; Kessler, B., Nunberg, G., Schuetze, H., Automatic detection of text genre (1997) Proceedings of the 35th Annual Meeting of the Association for Computational Linguistics and the 8th Meeting of the European Chapter of the Association for Computational Linguistics, pp. 32-38. , Morgan Kaufmann Publishers Madrid; Kwaśnik, B.H., Crowston, K., A framework for creating a faceted classification for genres: Addressing issues of multidimensionality (2004) Proceedings of the 37th Hawaii International Conference on System Sciences (HICSS-37), Big Island, HI, , IEEE Press Los Alamitos, CA; Liddy, E.D., The discourse-level structure of empirical abstracts: An exploratory study (1991) Information Processing and Management, 27 (1), pp. 55-81; Miller, C.R., Genre as social action (1984) Quarterly Journal of Speech, 70, pp. 151-167; Orlikowski, W.J., Yates, J., Genre repertoire: Examining the structuring of communicative practices in organizations (1994) Administrative Sciences Quarterly, 33, pp. 541-574; Swales, J., (1990) Genre Analysis: English in Academic Settings, , Cambridge University Press Cambridge; Toms, E.G., Campbell, D.G., Blades, R., (1999) Does Genre Define the Shape of Information? The Role of Form and Function in User Interaction with Digital Documents, , paper presented at the Annual Meeting of the American Society for Information Science (ASIS '99), October, Washington, DC; Watters, C., Shepherd, M., Cybergenre and web functionality (1999) Proceedings of the 32nd Hawaii International Conference on Systems Science, Maui, HI, , IEEE Press Los Alamitos, CA; Yates, S.J., Sumner, T., Digital genres and the new burden of fixity (1997) Proceedings of the 30th Hawaii International Conference on System Sciences (HICSS-30), Maui, HI, , IEEE Press Los Alamitos, CA",Article,Scopus
"Trushina I.","Freedom of access: Ethical dilemmas for Internet librarians",2004,"Electronic Library",22,5,,416,421,,4,"http://www.scopus.com/inward/record.url?eid=2-s2.0-10144255849&partnerID=40&md5=e81c2e74e22aceed2856969f04413c59","Libraries depend on ethical principles more than any other institution because library services are essentially human-oriented. Most national ethical principles for librarians are represented as professional ethic codes. Each of them eventually consolidates the ideology, the paradigm of national library services. Comparative analysis of national library ethic codes indicates the intellectual freedom principle as the key point and the superior ethical value for library services. With Internet technologies implemented in library services, the principle acquires a new significance and grave problems. Recent information filtering capacities provide a radically new censorship level, including anonymous censorship, violation of user privacy in Internet communications. On the one hand, librarians must follow the intellectual freedom principle, on the other, libraries are humanistic institutions, and librarians have a moral responsibility to the patrons, adhering to the value of human life. This paper discusses these issues as they relate to the Internet as well as the correlation of professional codes and their implementation in library practices. © Emerald Group Publishing Limited.","Censorship; Ethics; Internet; Libraries","Information services; Information technology; Internet; Libraries; Personnel; Professional aspects; Censorship; Ethics; Internet librarians; Professional ethic codes; Digital libraries","""Glavnie pravila bezopasnosti"" (2001) Biblioteka, (6), p. 26. , Biblioteka; (2000) Public Access and Freedom of Expression in Cultural Institutions: Guidelines for European Cultural Policy, , Council of Europe, DECS/CULT/NTI/libex (2000)2, Strasbourg, 8 June; Ezova, S.A., ""Kodeks professional'noj etiki rossiiskogo bibliotekarya prinat, no obsugdenie prodolgaetsya"" (2002) Nauchnie I Tehnicheskie Biblioteki, (10), p. 96; Firsov, V.R., Trushina, I.A., (2002) Bibliotechnaja Etika V Stranah Mira, , National Library of Russia, St Petersburg; (1999) Management of Library Associations Section: Developing Policies and Procedures for the Library Association, , International Federation of Library Associations and Institutions available at : www.ifla.org/VII/s40/pub/devpol-e.htm; Sturges, P., (1998) Freedom of Expression and the Communication Networks, , CC Cult (98)18, Strasbourg; Sturges, P., ""Internet, svoboda vyrazhenija i mesta obshestvennogo dostupa"" (2001) Tsenzura V Rossii: Istorija I Sovremennost, p. 233. , National Library of Russia, St Petersburg; Sussman, L., Deutsch Karlekar, K., (2002) The Annual Survey of Press Freedom, , (Eds) Freedom House, New York, NY, Washington, DC, Belgrade, Bucharest, Budapest, Kiev, Tashkent, Warsaw, available at: www.freedomhouse.org/pfs2002/pfs2002.pdf; Trushina, I.A., ""Ethica i electronnij mir"" (2002) Biblioteka, (9), pp. 6-9; Vaagan, R., (2002) The Ethics of Librarianship: an International Survey, , K.G. Saur, Munich; (2003) Declaration of Principles, , World Summit on Information Society WSIS-03/GENEVA/DOC/0004, available at: www.itu.int/wsis/documents/doc_multi-en-1161|1160.asp",Article,Scopus
